{
  "$schema": "http://json-schema.org/draft-07/schema#",
  "$id": "src/schemas/tokenlist",
  "title": "Flow Token List Schema",
  "description": "Schema for lists of Flow fungible tokens",
  "definitions": {
    "Version": {
      "type": "object",
      "description": "The version of the list, used in change detection",
      "examples": [
        {
          "major": 1,
          "minor": 0,
          "patch": 0
        }
      ],
      "additionalProperties": false,
      "properties": {
        "major": {
          "type": "integer",
          "description": "The major version of the list. Must be incremented when tokens are removed from the list or token addresses are changed.",
          "minimum": 0,
          "examples": [1, 2]
        },
        "minor": {
          "type": "integer",
          "description": "The minor version of the list. Must be incremented when tokens are added to the list.",
          "minimum": 0,
          "examples": [0, 1]
        },
        "patch": {
          "type": "integer",
          "description": "The patch version of the list. Must be incremented for any changes to the list.",
          "minimum": 0,
          "examples": [0, 1]
        }
      },
      "required": ["major", "minor", "patch"]
    },
    "TagIdentifier": {
      "type": "string",
      "description": "The unique identifier of a tag",
      "minLength": 1,
      "maxLength": 20,
      "pattern": "^[\\-\\w]+$",
      "examples": ["compound", "stablecoin"]
    },
    "TagDefinition": {
      "type": "object",
      "description": "Definition of a tag that can be associated with a token via its identifier",
      "additionalProperties": false,
      "properties": {
        "name": {
          "type": "string",
          "description": "The name of the tag",
          "pattern": "^[ \\-\\w]+$",
          "minLength": 1,
          "maxLength": 20
        },
        "description": {
          "type": "string",
          "description": "A user-friendly description of the tag",
          "pattern": "^[ \\-\\w\\.,:]+$",
          "minLength": 1,
          "maxLength": 200
        }
      },
      "required": ["name", "description"],
      "examples": [
        {
          "name": "Stablecoin",
          "description": "A token with value pegged to another asset"
        }
      ]
    }
  },
  "type": "object",
  "additionalProperties": false,
  "properties": {
    "name": {
      "type": "string",
      "description": "The name of the token list",
      "minLength": 1,
      "maxLength": 20,
      "pattern": "^[\\w ]+$",
      "examples": ["My Token List"]
    },
    "timestamp": {
      "type": "string",
      "format": "date-time",
      "description": "The timestamp of this list version; i.e. when this immutable version of the list was created"
    },
    "version": {
      "$ref": "#/definitions/Version"
    },
    "tokens": {
      "type": "array",
      "description": "The list of tokens included in the list",
      "items": {
        "$ref": "token.schema.json"
      },
      "minItems": 1,
      "maxItems": 10000
    },
    "keywords": {
      "type": "array",
      "description": "Keywords associated with the contents of the list; may be used in list discoverability",
      "items": {
        "type": "string",
        "description": "A keyword to describe the contents of the list",
        "minLength": 1,
        "maxLength": 20,
        "pattern": "^[\\w ]+$",
        "examples": ["compound", "lending", "personal tokens"]
      },
      "maxItems": 20,
      "uniqueItems": true
    },
    "tags": {
      "type": "object",
      "description": "A mapping of tag identifiers to their name and description",
      "propertyNames": {
        "$ref": "#/definitions/TagIdentifier"
      },
      "additionalProperties": {
        "$ref": "#/definitions/TagDefinition"
      },
      "maxProperties": 20,
      "examples": [
        {
          "stablecoin": {
            "name": "Stablecoin",
            "description": "A token with value pegged to another asset"
          }
        }
      ]
    },
    "logoURI": {
      "type": "string",
      "description": "A URI for the logo of the token list; prefer SVG or PNG of size 256x256",
      "format": "uri",
      "examples": ["ipfs://QmXfzKRvjZz3u5JRgC4v5mGVbm9ahrUiB4DgzHBsnWbTMM"]
    }
  },
  "required": ["name", "timestamp", "version", "tokens"]
}
