{
  "name": "Flow Token List",
  "logoURI": "https://cdn.jsdelivr.net/gh/FlowFans/flow-token-list@main/token-registry/FLOW/logo.png",
  "keywords": [
    "flow",
    "fnt"
  ],
  "tags": {
    "stablecoin": {
      "name": "stablecoin",
      "description": "Tokens that are fixed to an external asset, e.g. the US dollar"
    },
    "ethereum": {
      "name": "ethereum",
      "description": "Asset bridged from ethereum"
    },
    "wrapped-celer": {
      "name": "wrapped-celer",
      "description": "Asset wrapped using celer bridge"
    },
    "lp-token": {
      "name": "lp-token",
      "description": "Asset representing liquidity provider token"
    },
    "nft": {
      "name": "nft",
      "description": "Non-fungible token"
    },
    "security-token": {
      "name": "security-token",
      "description": "Tokens that are used to gain access to an electronically restricted resource"
    },
    "utility-token": {
      "name": "utility-token",
      "description": "Tokens that are designed to be spent within a certain blockchain ecosystem"
    },
    "governance-token": {
      "name": "governance-token",
      "description": "Tokens that are designed to be use in community governance and maintenance"
    }
  },
  "timestamp": "2021-04-04T12:00:00+0000",
  "tokens": [
    {
      "address": "0x1654653399040a61",
      "contractName": "FlowToken",
      "path": {
        "provider":  "/storage/flowTokenVault",
        "balance":  "/public/flowTokenBalance",
        "receiver":  "/public/flowTokenReceiver"
      },
      "symbol": "FLOW",
      "name": "Flow",
      "decimals": 8,
      "logoURI": "https://cdn.jsdelivr.net/gh/FlowFans/flow-token-list@main/token-registry/FLOW/logo.svg",
      "tags": [
        "utility-token"
      ],
      "extensions": {
        "website": "https://www.onflow.org",
        "twitter": "https://twitter.com/flow_blockchain",
        "discord": "http://discord.gg/flow"
      }
    },
    {
      "address": "0x3c5959b568896393",
      "contractName": "FUSD",
      "path": {
        "provider":  "/storage/fusdVault",
        "balance":  "/public/fusdBalance",
        "receiver":  "/public/fusdReceiver"
      },
      "symbol": "FUSD",
      "name": "Flow USD",
      "decimals": 8,
      "logoURI": "https://cdn.jsdelivr.net/gh/FlowFans/flow-token-list@main/token-registry/FUSD/logo.svg",
      "tags": [
        "stablecoin"
      ],
      "extensions": {
        "website": "https://docs.onflow.org/fusd/"
      }
    },
    {
      "address": "0x0f9df91c9121c460",
      "contractName": "BloctoToken",
      "path": {
        "provider": "/storage/bloctoTokenVault",
        "balance": "/public/bloctoTokenBalance",
        "receiver": "/public/bloctoTokenReceiver"
      },
      "symbol": "BLT",
      "name": "Blocto Token",
      "decimals": 8,
      "logoURI": "https://cdn.jsdelivr.net/gh/FlowFans/flow-token-list@main/token-registry/BLT/logo.png",
      "tags": [
        "utility-token"
      ],
      "extensions": {
        "website": "https://blocto.app/"
      }
    },
    {
      "address": "0x348fe2042c8a70d8",
      "contractName": "MyToken",
      "path": {
        "provider": "/storage/mytokenVault",
        "balance": "/public/mytokenBalance",
        "receiver": "/public/mytokenReceiver"
      },
      "symbol": "MY",
      "name": "My Token",
      "decimals": 8,
      "logoURI": "https://cdn.jsdelivr.net/gh/FlowFans/flow-token-list@main/token-registry/MY/logo.svg",
      "tags": [
        "utility-token"
      ],
      "extensions": {
        "website": "https://mynft.io/"
      }
    },
    {
      "address": "0x142fa6570b62fd97",
      "contractName": "StarlyToken",
      "path": {
        "provider":  "/storage/starlyTokenVault",
        "balance":  "/public/starlyTokenBalance",
        "receiver":  "/public/starlyTokenReceiver"
      },
      "symbol": "STARLY",
      "name": "Starly Token",
      "decimals": 8,
      "logoURI": "https://cdn.jsdelivr.net/gh/FlowFans/flow-token-list@main/token-registry/STARLY/logo.png",
      "tags": [
        "utility-token"
      ],
      "extensions": {
        "website": "https://starly.io/"
      }
    },
    {
      "address": "0xb19436aae4d94622",
      "contractName": "FiatToken",
      "path": {
        "provider": "/storage/USDCVault",
        "balance": "/public/USDCVaultBalance",
        "receiver": "/public/USDCVaultReceiver"
      },
      "symbol": "USDC",
      "name": "USD Coin",
      "decimals": 8,
      "logoURI": "https://cdn.jsdelivr.net/gh/FlowFans/flow-token-list@main/token-registry/USDC/logo.svg",
      "tags": [
        "stablecoin"
      ],
      "extensions": {
        "website": "https://www.circle.com/"
      }
    }
  ],
  "version": {
    "major": 0,
    "minor": 1,
    "patch": 0
  }
}
