{
  "name": "Flow Token List",
  "logoURI": "https://cdn.jsdelivr.net/gh/FlowFans/flow-token-list@main/token-registry/A.1654653399040a61.FlowToken/logo.svg",
  "keywords": ["flow", "fnt"],
  "tags": {
    "stablecoin": {
      "name": "stablecoin",
      "description": "Tokens that are fixed to an external asset, e.g. the US dollar"
    },
    "ethereum": {
      "name": "ethereum",
      "description": "Asset bridged from ethereum"
    },
    "teleported-token": {
      "name": "teleported-token",
      "description": "Asset teleported from other blockchains by Blocto"
    },
    "wrapped-celer": {
      "name": "wrapped-celer",
      "description": "Asset wrapped using celer bridge"
    },
    "lp-token": {
      "name": "lp-token",
      "description": "Asset representing liquidity provider token"
    },
    "nft": {
      "name": "nft",
      "description": "Non-fungible token"
    },
    "security-token": {
      "name": "security-token",
      "description": "Tokens that are used to gain access to an electronically restricted resource"
    },
    "utility-token": {
      "name": "utility-token",
      "description": "Tokens that are designed to be spent within a certain blockchain ecosystem"
    },
    "governance-token": {
      "name": "governance-token",
      "description": "Tokens that are designed to be use in community governance and maintenance"
    }
  },
  "timestamp": "2021-04-04T12:00:00+0000",
  "tokens": [],
  "version": {
    "major": 0,
    "minor": 1,
    "patch": 0
  }
}
